{
  "id": "waveshare-esp32-c5-wifi6-kit",
  "vendor": "Waveshare",
  "model": "ESP32-C5-WIFI6-KIT-N16R8",
  "name": "Waveshare ESP32-C5 dual-band WiFi 6 development board",
  "target": "esp32c5",
  "package": "ESP32-C5HR8",
  "flashBytes": 16777216,
  "flashSizes": [
    16777216,
    33554432
  ],
  "psramBytes": 8388608,
  "usbBridge": {
    "chip": "CH343",
    "vid": "1a86",
    "pid": "55d3"
  },
  "features": [
    "wifi",
    "ble"
  ],
  "buyUrl": "https://www.waveshare.com/esp32-c5-wifi6-kit-n16r4.htm",
  "notes": "WiFi on 2.4 and 5 GHz. Sold as N16R8 (8 MB PSRAM) and N16R4 (4 MB); the -M versions come with the pin headers soldered on."
}
